{"bundle_sha256":"cdb6569a9af1bdcd28a823529375c1e28ac22bbaf255117bb2b8c014a5334734","created_at":"2026-08-12T00:00:00Z","declared_verdict":"COMPLETE","event_ids":["safe-intent-001","safe-scope-001","safe-decision-001","safe-approval-001","safe-execution-001","safe-result-001","safe-verification-001","safe-persistence-001"],"privacy_profile":"portable-evidence","producer_class":"synthetic","protocol_registry_sha256":"cb5000ca90a1395c5efdf7362b5d9928fea70915a96af3c3b10542a7abbf0a14","required_stages":["intent","scope","decision","approval","execution","result","verification","persistence"],"run_id":"flight-safe-001","schema_version":"mothership.flight-index.v1"}
