{"bundle_sha256":"c2448aa008912e1626c905ca6a2b08a9264bb073e228e7e7bf3f631730a00f8e","created_at":"2026-08-12T00:00:00Z","declared_verdict":"DRIFTED","event_ids":["drift-intent-001","drift-scope-001","drift-decision-001","drift-approval-001","drift-execution-001","drift-result-001","drift-verification-001","drift-persistence-001"],"privacy_profile":"portable-evidence","producer_class":"synthetic","protocol_registry_sha256":"cb5000ca90a1395c5efdf7362b5d9928fea70915a96af3c3b10542a7abbf0a14","required_stages":["intent","scope","decision","approval","execution","result","verification","persistence"],"run_id":"flight-drift-001","schema_version":"mothership.flight-index.v1"}
